{
  "schema_version": "1.0.0",
  "input_id": "ci-33333333-3333-4333-8333-333333333333",
  "rule_pack": {
    "pack_id": "scw-qatar-starter",
    "pack_version": "0.2.0",
    "sha256": "1ea71e863f05f7b8c1c2fd64ce0b58fd03de5a3512e25b15d4bee64451cae042",
    "status": "draft"
  },
  "engine_version": "1.0.0",
  "items": [
    {
      "item_ref": "item-ft-takaful",
      "domain_id": "d_takaful",
      "term_ids": [
        "term-takaful"
      ],
      "verdict_proposed": "doubtful",
      "confirmed_by_operator": false,
      "verdict_recorded": null,
      "evidence": [
        {
          "rule_id": "rule-takaful-tabarru",
          "outcome": "doubtful",
          "severity": "advisory",
          "trigger": {
            "type": "term",
            "term_id": "term-takaful",
            "surface_form": "تكافل",
            "match_text": "تكافل",
            "start_offset": 8,
            "end_offset": 13
          },
          "citation_ids": [
            "cit-aaoifi-ss26"
          ],
          "citation_status": "unverified",
          "rationale": {
            "en": "Takaful requires tabarru'-based contributions and Shariah-screened investment of the fund; the engine cannot verify the declared contribution_model against a verified source, so the item is flagged doubtful.",
            "ar": "يتطلب التكافل اشتراكات تبرعية واستثمارا شرعيا للصندوق؛ ولا يستطيع المحرك التحقق من نموذج الاشتراك من مصدر موثق، فتُعلَّم البنود بالشك."
          }
        },
        {
          "rule_id": "rule-takaful-tabarru",
          "outcome": "doubtful",
          "severity": "advisory",
          "trigger": {
            "type": "term",
            "term_id": "term-takaful",
            "surface_form": "takaful",
            "match_text": "takaful",
            "start_offset": 62,
            "end_offset": 69
          },
          "citation_ids": [
            "cit-aaoifi-ss26"
          ],
          "citation_status": "unverified",
          "rationale": {
            "en": "Takaful requires tabarru'-based contributions and Shariah-screened investment of the fund; the engine cannot verify the declared contribution_model against a verified source, so the item is flagged doubtful.",
            "ar": "يتطلب التكافل اشتراكات تبرعية واستثمارا شرعيا للصندوق؛ ولا يستطيع المحرك التحقق من نموذج الاشتراك من مصدر موثق، فتُعلَّم البنود بالشك."
          }
        },
        {
          "rule_id": "rule-gharar-term",
          "outcome": "doubtful",
          "severity": "advisory",
          "trigger": {
            "type": "term",
            "term_id": "term-gharar",
            "surface_form": "gharar",
            "match_text": "gharar",
            "start_offset": 160,
            "end_offset": 166
          },
          "citation_ids": [
            "cit-fiqh-consensus-gharar-maysir"
          ],
          "citation_status": "unverified",
          "rationale": {
            "en": "Excessive uncertainty is flagged for human review; the pack's citation is unverified, so advisory only.",
            "ar": "الغرر الزائد يُعلَّم للمراجعة البشرية؛ الإسناد غير موثق فتُعد القاعدة تنبيها فقط."
          }
        }
      ],
      "unverified_findings": [
        {
          "rule_id": "rule-takaful-tabarru",
          "outcome": "doubtful",
          "severity": "advisory",
          "trigger": {
            "type": "term",
            "term_id": "term-takaful",
            "surface_form": "تكافل",
            "match_text": "تكافل",
            "start_offset": 8,
            "end_offset": 13
          },
          "citation_ids": [
            "cit-aaoifi-ss26"
          ],
          "citation_status": "unverified",
          "rationale": {
            "en": "Takaful requires tabarru'-based contributions and Shariah-screened investment of the fund; the engine cannot verify the declared contribution_model against a verified source, so the item is flagged doubtful.",
            "ar": "يتطلب التكافل اشتراكات تبرعية واستثمارا شرعيا للصندوق؛ ولا يستطيع المحرك التحقق من نموذج الاشتراك من مصدر موثق، فتُعلَّم البنود بالشك."
          }
        },
        {
          "rule_id": "rule-takaful-tabarru",
          "outcome": "doubtful",
          "severity": "advisory",
          "trigger": {
            "type": "term",
            "term_id": "term-takaful",
            "surface_form": "takaful",
            "match_text": "takaful",
            "start_offset": 62,
            "end_offset": 69
          },
          "citation_ids": [
            "cit-aaoifi-ss26"
          ],
          "citation_status": "unverified",
          "rationale": {
            "en": "Takaful requires tabarru'-based contributions and Shariah-screened investment of the fund; the engine cannot verify the declared contribution_model against a verified source, so the item is flagged doubtful.",
            "ar": "يتطلب التكافل اشتراكات تبرعية واستثمارا شرعيا للصندوق؛ ولا يستطيع المحرك التحقق من نموذج الاشتراك من مصدر موثق، فتُعلَّم البنود بالشك."
          }
        },
        {
          "rule_id": "rule-gharar-term",
          "outcome": "doubtful",
          "severity": "advisory",
          "trigger": {
            "type": "term",
            "term_id": "term-gharar",
            "surface_form": "gharar",
            "match_text": "gharar",
            "start_offset": 160,
            "end_offset": 166
          },
          "citation_ids": [
            "cit-fiqh-consensus-gharar-maysir"
          ],
          "citation_status": "unverified",
          "rationale": {
            "en": "Excessive uncertainty is flagged for human review; the pack's citation is unverified, so advisory only.",
            "ar": "الغرر الزائد يُعلَّم للمراجعة البشرية؛ الإسناد غير موثق فتُعد القاعدة تنبيها فقط."
          }
        }
      ],
      "limits_applied": [
        "single_run_scope",
        "no_stemming_ar",
        "unmatched_content_not_assessed",
        "advisory_only_unverified_citations"
      ]
    },
    {
      "item_ref": "item-ft-gharar",
      "domain_id": "d_financing_contracts",
      "term_ids": [
        "term-gharar"
      ],
      "verdict_proposed": "doubtful",
      "confirmed_by_operator": false,
      "verdict_recorded": null,
      "evidence": [
        {
          "rule_id": "rule-gharar-term",
          "outcome": "doubtful",
          "severity": "advisory",
          "trigger": {
            "type": "term",
            "term_id": "term-gharar",
            "surface_form": "gharar",
            "match_text": "gharar",
            "start_offset": 160,
            "end_offset": 166
          },
          "citation_ids": [
            "cit-fiqh-consensus-gharar-maysir"
          ],
          "citation_status": "unverified",
          "rationale": {
            "en": "Excessive uncertainty is flagged for human review; the pack's citation is unverified, so advisory only.",
            "ar": "الغرر الزائد يُعلَّم للمراجعة البشرية؛ الإسناد غير موثق فتُعد القاعدة تنبيها فقط."
          }
        }
      ],
      "unverified_findings": [
        {
          "rule_id": "rule-gharar-term",
          "outcome": "doubtful",
          "severity": "advisory",
          "trigger": {
            "type": "term",
            "term_id": "term-gharar",
            "surface_form": "gharar",
            "match_text": "gharar",
            "start_offset": 160,
            "end_offset": 166
          },
          "citation_ids": [
            "cit-fiqh-consensus-gharar-maysir"
          ],
          "citation_status": "unverified",
          "rationale": {
            "en": "Excessive uncertainty is flagged for human review; the pack's citation is unverified, so advisory only.",
            "ar": "الغرر الزائد يُعلَّم للمراجعة البشرية؛ الإسناد غير موثق فتُعد القاعدة تنبيها فقط."
          }
        }
      ],
      "limits_applied": [
        "single_run_scope",
        "no_stemming_ar",
        "advisory_only_unverified_citations"
      ]
    }
  ]
}
