{
  "schema_version": "1.0.0",
  "input_id": "ci-11111111-1111-4111-8111-111111111111",
  "rule_pack": {
    "pack_id": "scw-qatar-starter",
    "pack_version": "0.2.0",
    "sha256": "1ea71e863f05f7b8c1c2fd64ce0b58fd03de5a3512e25b15d4bee64451cae042",
    "status": "draft"
  },
  "engine_version": "1.0.0",
  "items": [
    {
      "item_ref": "item-ex-ijara-ok",
      "domain_id": "d_leasing",
      "term_ids": [
        "term-ijara"
      ],
      "verdict_proposed": "doubtful",
      "confirmed_by_operator": true,
      "verdict_recorded": null,
      "evidence": [
        {
          "rule_id": "rule-ijara-ownership",
          "outcome": "doubtful",
          "severity": "advisory",
          "trigger": {
            "type": "term_ref",
            "term_id": "term-ijara",
            "surface_form": "ijara"
          },
          "citation_ids": [
            "cit-aaoifi-ss9"
          ],
          "citation_status": "unverified",
          "rationale": {
            "en": "Ijara requires the lessor to retain ownership and major risk during the lease term; the engine cannot verify the worksheet's asset_owner assertion against a verified source, so the item is flagged doubtful.",
            "ar": "تتطلب الإجارة بقاء الملكية والضمان للمؤجر خلال مدة العقد؛ ولا يستطيع المحرك التحقق من ذلك من مصدر موثق، فتُعلَّم البنود بالشك."
          }
        }
      ],
      "unverified_findings": [
        {
          "rule_id": "rule-ijara-ownership",
          "outcome": "doubtful",
          "severity": "advisory",
          "trigger": {
            "type": "term_ref",
            "term_id": "term-ijara",
            "surface_form": "ijara"
          },
          "citation_ids": [
            "cit-aaoifi-ss9"
          ],
          "citation_status": "unverified",
          "rationale": {
            "en": "Ijara requires the lessor to retain ownership and major risk during the lease term; the engine cannot verify the worksheet's asset_owner assertion against a verified source, so the item is flagged doubtful.",
            "ar": "تتطلب الإجارة بقاء الملكية والضمان للمؤجر خلال مدة العقد؛ ولا يستطيع المحرك التحقق من ذلك من مصدر موثق، فتُعلَّم البنود بالشك."
          }
        }
      ],
      "limits_applied": [
        "single_run_scope",
        "advisory_only_unverified_citations"
      ]
    },
    {
      "item_ref": "item-ex-ijara-noowner",
      "domain_id": "d_leasing",
      "term_ids": [
        "term-ijara"
      ],
      "verdict_proposed": "insufficient_input",
      "confirmed_by_operator": true,
      "verdict_recorded": null,
      "evidence": [
        {
          "rule_id": "rule-ijara-ownership",
          "outcome": "doubtful",
          "severity": "advisory",
          "trigger": {
            "type": "term_ref",
            "term_id": "term-ijara",
            "surface_form": "ijara"
          },
          "citation_ids": [
            "cit-aaoifi-ss9"
          ],
          "citation_status": "unverified",
          "rationale": {
            "en": "Ijara requires the lessor to retain ownership and major risk during the lease term; the engine cannot verify the worksheet's asset_owner assertion against a verified source, so the item is flagged doubtful.",
            "ar": "تتطلب الإجارة بقاء الملكية والضمان للمؤجر خلال مدة العقد؛ ولا يستطيع المحرك التحقق من ذلك من مصدر موثق، فتُعلَّم البنود بالشك."
          }
        }
      ],
      "unverified_findings": [
        {
          "rule_id": "rule-ijara-ownership",
          "outcome": "doubtful",
          "severity": "advisory",
          "trigger": {
            "type": "term_ref",
            "term_id": "term-ijara",
            "surface_form": "ijara"
          },
          "citation_ids": [
            "cit-aaoifi-ss9"
          ],
          "citation_status": "unverified",
          "rationale": {
            "en": "Ijara requires the lessor to retain ownership and major risk during the lease term; the engine cannot verify the worksheet's asset_owner assertion against a verified source, so the item is flagged doubtful.",
            "ar": "تتطلب الإجارة بقاء الملكية والضمان للمؤجر خلال مدة العقد؛ ولا يستطيع المحرك التحقق من ذلك من مصدر موثق، فتُعلَّم البنود بالشك."
          }
        }
      ],
      "limits_applied": [
        "single_run_scope",
        "required_field_missing",
        "advisory_only_unverified_citations"
      ]
    }
  ]
}
